university,year,country,frequency,evidence_provided,evidence_details,framework_used_used,framework_used_name,challenges_acknowledged,challenges_details,third_party_verification_provided,third_party_verification_company,scope_3_emissions_included,scope_3_emissions_details,energy_breakdown_provided,energy_breakdown_details,waste_management_provided,waste_management_details,water_consumption_reported,water_consumption_details,green_building_certifications_included,green_building_certifications_details,external_collaborations_collaborated,external_collaborations_details,social_responsibility_included,social_responsibility_details,leadership_involvement_involved,leadership_involvement_details,funding_transparency_transparent,funding_transparency_details
University of Lincoln,2022/23,United Kingdom,annually,Yes,"['1. £453,000 spent on Carbon Management Projects in 22/23.', '2. Projects saving almost 700,000 kilowatts of energy per year, resulting in savings of circa £88,000 and 123 tonnes of CO2e.', '3. Electricity, gas, oil & LGP consumption fell from 35.6GWh in 21/22 to 33.7GWh in 22/23.', '4. Water consumption reduced from 11.05m3 per student in 2021/22 to 10.54m3 in 2022/23.', '5. Waste tonnage increased by 8% from 21/22 to 22/23, recycling rates slightly decreased.']",Yes,"ISO14001, ISO50001, UN SDGs",Yes,"['1. Target of reducing waste by 5% was not met; waste tonnage increased by 8%.', '2. The percentage of waste recycled decreased slightly from 27.2% to 26.7%.', '3. Spill response training planned for key staff for December 2023 to prevent pollution.']",Yes,AECOM,Yes,"['1. Gain a fuller understanding of Scope 3 emissions and plan for yearly reduction.', '2. Transportation policy aimed at reducing business travel carbon emissions.']",No,"['1. No specific breakdown of renewable vs. non-renewable sources.', '2. Total energy consumption reported as 33.7GWh in 22/23.']",Yes,"Waste tonnage increased by 8% from 21/22 to 22/23, with recycling rates decreasing slightly. Efforts included implementing league tables and signage improvements at accommodations.",Yes,Water consumption reduced from 11.05m3 per student in 2021/22 to 10.54m3 in 2022/23.,Yes,EcoCampus Platinum Award,Yes,"Nature Positive University Alliance, British Heart Foundation",Yes,"['1. Raised over £105,000 for the British Heart Foundation.', '2. Offered Carbon Literacy Training and supported sustainability-related student volunteering.']",Yes,"['1. Dean of Sustainability leading the Education for Sustainable Development working group.', '2. Executive leadership involved in setting targets and developing the Net Zero Roadmap.']",Yes,"['1. Carbon Management Projects expenditure of £453,000 disclosed.', '2. Cost savings of circa £88,000 through energy-saving projects were reported.']"
University of Windsor,2024,Canada,annually,Yes,"['1. 36% reduction in overall greenhouse gas emissions since 2019.', '2. 45% reduction in greenhouse gas emissions target by 2030.', '3. 474,622 social media impressions on UMindsor sustainability posts.', '4. 1,430,796 single use plastics water bottles diverted from landfill.', '5. 22 electric vehicle charging stations installed on campus.']",Yes,"Taskforce for Climate Disclosures framework (TCFD), UN Sustainable Development Goals (SDGs), Principles for Responsible Investing (PRI)",Yes,"['1. Impacts of climate change becoming more apparent.', '2. Challenge of transitioning to a low-carbon economy.', '3. Financial and operational risks related to climate change.']",No,,No,[],No,[],Yes,29% waste diversion rate; introduction of organics collection and expansion of composting collection.,No,,No,,Yes,Collaboration with Essex Power Corporation for electric vehicle charging stations and collaboration with Essex Region Conservation Authority for Earth Day events.,Yes,"['1. Lancers Care initiative hosting well-being events and activities.', '2. Campus Community Garden initiatives and workshops.']",Yes,"['1. The Vice-President, Finance & Operations and the Provost and Vice-President, Academic serve as co-Chairs of the Campus Sustainability Committee.', '2. The President & Vice-Chancellor is ultimately responsible for ensuring that relevant stakeholders are informed about sustainability risks and opportunities.']",Yes,"['1. Responsible Investment Policy guides the investment of a $1.1B portfolio.', '2. Disclosure of Responsible Investment Strategy and Asset Class Allocation.']"
University of Waterloo,2022,Canada,annually,Yes,"['1. 35.8% waste diversion rate.', '2. 33% reduction in water use intensity since 2015.', '3. 8.6% reduction in Scope 1+2 emissions since 2015.', '4. 25% of food and beverage purchases are local or sustainably certified.', '5. 93% of student and employee trips to campus use sustainable methods.']",Yes,"Sustainability Tracking, Assessment & Rating System (STARS), United Nations Sustainable Development Goals (UN SDGs)",Yes,"['1. Slow progress on emissions reductions to achieve 2025 targets.', '2. Barriers and fatigue from the pandemic affecting change management.', '3. Supply chain risks impacting implementation costs.', '4. Systemic structures not fully aligned with strategic goals.']",No,,Partial,"['1. Business travel vehicle emissions.', '2. Commuting estimate emissions.']",No,"['1. Energy consumption data available without source breakdown.', '2. Total energy savings projects mentioned but no specific breakdown.']",Yes,"35.8% waste diverted from landfill, various recycling programs in place.",Yes,33% reduction in water use intensity since 2015.,No,Not mentioned in the report.,Yes,"UN Race to Zero, Regional Sustainability Initiative, University Global Coalition, UN PRI.",Yes,"['1. Green Volunteer Program for students.', '2. Eco-anxiety management discussions.']",Yes,"['1. Message from the President acknowledging climate action.', '2. Strategic planning aligned with environmental goals.']",Yes,"['1. Lifecycle costing guideline developed.', '2. Internal subsidy for purchasing electric vehicles in the fleet.']"
NC State University,2024,United States,annually,Yes,"['1. 1,446 first-year and transfer students completed the Summer 2024 multidisciplinary experience.', '2. NC State’s dining increased local food sourcing to 13.2%, including purchasing 20,416 pounds of sustainable seafood.', '3. A Battery Energy Storage System on Centennial Campus provides energy back to the grid, offering cost savings.', '4. Student-led initiatives opened a Campus Thrift Store to promote sustainable fashion.', '5. NC State avoided $478,830 in energy costs from the Holiday Energy Savings Initiative.']",No,,No,[],No,,Yes,"['1. Included in the campus greenhouse gas emissions chart.', '2. Data is shown for FY2021 through FY2024.']",No,[],Yes,Campus Waste Diversion Rate and Waste Material chart showing 55% diverted waste.,Yes,"Campus water use reduction by 52% is highlighted, with charts showing changes over fiscal years.",No,,Yes,United StatesGS Southeast Climate Adaptation Science Center for climate change research by Global Change Fellows.,Yes,"['1. Student projects like the Social Innovation Fellows program focusing on ethics and sustainability.', '2. Sustainability-themed events, including Earth Month activities and the EcoVillage thrift store.']",Yes,"['1. Faculty from the Civil, Construction, and Environmental Engineering lead research projects.', '2. University administration facilitated the completion of the new Physical Master Plan with sustainability as a guiding principle.']",No,[]
Dalhousie University,2022-2023,Canada,annually,Yes,"['1. Waste diversion increased to 61% with specific targets for future years.', '2. Electricity consumption reduced by 7% absolute and 25% per person.', '3. GHG emissions reduced by 38% and 53% per person.', '4. External funding of $94,867 was raised for sustainability projects.', '5. Over 50 students engaged through various sustainability initiatives.']",Yes,STARS and Times Higher Education Impact Ranking,Yes,"['1. Waste minimization requires additional human resources and product switching.', '2. Ongoing planning for climate adaptation strategies.', '3. Continuous updates and negotiations needed for project funding applications.']",No,Not specified,Yes,"['1. Includes commuting.', '2. Considers water use and materials.']",No,"['1. Renewable vs. non-renewable breakdown not specified.', '2. Mention of renewable energy projects but no specific breakdown.']",Yes,"Includes programs for recycling, waste avoidance, and aggressive diversion targets.",Yes,Potable water reduced by 64% with additional use from wells for research.,Yes,"LEED Gold or higher targeted for new buildings, LEED Platinum projected for some.",Yes,"Collaborates with Atlantic Universities, Colleges Sustainability Network, and NECSC.",Yes,"['1. Over 1423 people engaged through presentations and seminars.', '2. Initiatives to increase equity, diversity, inclusion, and accessibility.']",Yes,"['1. President’s Advisory Council on Sustainability involves students.', '2. Leadership roles in sustainability networks suggest senior involvement.']",Yes,"['1. Detailed funding matrix updated and multi-million grant mentioned.', '2. Total external funding since 2008 mentioned ($8,600,612).']"
New Jersey Institute of Technology,2023,United States,Irregularly,Yes,"['1. Participation in the Sustainability Tracking, Assessment & Rating System (STARS) for measurable progress', '2. Improvement in Times Higher Education Impact Rankings with specific scores and rankings', '3. Highlights specific projects like the Urban Food Forest and wastewater management initiatives', ""4. Specific data on NJIT's rank and score in various sustainability impact categories"", '5. Quantifiable goals such as carbon neutrality by 2040']",Yes,"SDGs, STARS",Yes,"['1. The need for improvements in all three dimensions of sustainability: economic, social, and environmental', '2. Aim for carbon neutrality by 2040 indicating long-term challenges', '3. Challenges in community engagement and expanding reach outside campus']",Yes,STARS by AASHE,No,[],No,[],Yes,Efforts include recycling electronic waste and co-digestion projects,Yes,Initiatives to restore and protect ponds and lakes,No,,Yes,Collaboration with NJHEPS for sustainability in higher education,Yes,"['1. NJIT Food Pantry and Urban Food Forest initiatives', '2. Engagement in events like Earth Day and STEM education for underprivileged students']",Yes,"[""1. President Dr. Teik C. Lim's involvement"", ""2. Senior Vice President Andrew P. Christ's commitment to sustainability""]",No,[]
